thread_id,source_file,subject,messages,message_count,full_text,senders,date_range,text_for_classification,prob_score,risk_flag,score_sexual_exploitation_or_trafficking,score_financial_fraud_or_money_laundering,score_obstruction_or_witness_tampering,score_bribery_or_corruption,score_coercion_or_blackmail,score_network_facilitation_or_coordination,offense_labels,primary_offense,entities,offense_labels_display,senders_display,risk_display,entities_json
TEXT-001-HOUSE_OVERSIGHT_031683.txt_2,TEXT-001-HOUSE_OVERSIGHT_031683.txt,Re:,"[{""sender"": ""J [jeevacation@gmail.com]"", ""recipients"": [""Michael Wolff""], ""timestamp"": ""5/30/2019 5:29 PM"", ""subject"": ""Re:"", ""body"": ""is it a coincidence that the russian that bought the house in palm beach and knows all , is the same guy that \nsold a painting last year to mbs for 450 million dollars. that was only worth 1. 5m?""}, {""sender"": ""Michael Wolff"", ""recipients"": [], ""timestamp"": ""5/30/2019 5:33 PM"", ""subject"": ""Re:"", ""body"": ""So MBS was paying him off? Why? Ideas?""}, {""sender"": ""J [jeevacation@gmail.com]"", ""recipients"": [""Michael Wolff""], ""timestamp"": ""5/30/2019 9:34:38 PM"", ""subject"": ""Re:"", ""body"": ""maybe as a favor to trump. in exchange for yemen and iran support. . smells doesnt it?""}]",3,"is it a coincidence that the russian that bought the house in palm beach and knows all , is the same guy that sold a painting last year to mbs for 450 million dollars. that was only worth 1. 5m? [MSG] So MBS was paying him off? Why? Ideas? [MSG] maybe as a favor to trump. in exchange for yemen and iran support. . smells doesnt it?","['J [jeevacation@gmail.com]', 'Michael Wolff']",5/30/2019 5:29 PM → 5/30/2019 9:34:38 PM,"Re: is it a coincidence that the russian that bought the house in palm beach and knows all , is the same guy that sold a painting last year to mbs for 450 million dollars. that was only worth 1. 5m? [MSG] So MBS was paying him off? Why? Ideas? [MSG] maybe as a favor to trump. in exchange for yemen and iran support. . smells doesnt it?",0.9891155362129213,1,0.010515996254980564,0.7469064593315125,0.73099285364151,0.9851750135421753,0.9743967652320862,0.8113707304000854,"['financial fraud or money laundering', 'obstruction or witness tampering', 'bribery or corruption', 'coercion or blackmail', 'network facilitation or coordination']",financial fraud or money laundering,"{'GPE': ['palm beach', 'yemen', 'iran'], 'DATE': ['last year'], 'MONEY': ['450 million dollars'], 'PERSON': ['MBS', 'smells']}","financial fraud or money laundering, obstruction or witness tampering, bribery or corruption, coercion or blackmail, network facilitation or coordination","J [jeevacation@gmail.com], Michael Wolff",⚠️ Problematic,"{'GPE': ['palm beach', 'yemen', 'iran'], 'DATE': ['last year'], 'MONEY': ['450 million dollars'], 'PERSON': ['MBS', 'smells']}"
TEXT-001-HOUSE_OVERSIGHT_022827.txt_12,TEXT-001-HOUSE_OVERSIGHT_022827.txt,Re:,"[{""sender"": ""jeffrey E. <jeevacation@gmail.com>"", ""recipients"": [""Michael Wolff""], ""timestamp"": ""Fri, Jan 9, 2015 at 1:20 PM"", ""subject"": ""Re:"", ""body"": ""____________________ the story teller , crafted much of it out of whole cloth. . part of her story, is that she was at multiple orgies with clinton and speciifically, the minute details of a dinner had on the island with him, \"" he sat on my left. came by black. heli. flown by ghislaine. clinton was NEVER EVER there, never, it punches a hole in the dershowitz , andrew allegation. making it all apparent that it was fantasy. and delusional. thoughts. who should break the story.""}, {""sender"": ""Michael Wolff <:MM11>"", ""recipients"": [], ""timestamp"": ""Fri, Jan 9, 2015 at 2:33 PM"", ""subject"": ""Re:"", ""body"": ""Is Clinton willing to say he was not there? Btw, I've just filed a column for USA Today for Monday explaining how Dershowitz and Andrew allegations were picked up from unverified civil court docs, transferred to UK tabs, which go wild because of no libel rules on U.S. court papers, and then translated back here as \""reported fact.\"" Problem with Mi=story is that tabs are too invested in present story line, and unlikely that the Times or WSJ will want to touch it--tho, depending on who is willing to on record, they might. There is another politico reporter I know who might do it, again, if the on-the-record sources are public people. Or, I will use it for New York Magazine, but that won't be until Feb. Can you still talk tomorrow? When works? Woody and Soon-Yi coming for dinner tonight. m""}, {""sender"": ""jeffrey E. <jeevacation@gmail.com>"", ""recipients"": [], ""timestamp"": ""Fri, Jan 9, 2015 at 1:44 PM"", ""subject"": ""Re:"", ""body"": ""anytime tomorw ok""}, {""sender"": ""Michael Wolff <_____________________________>"", ""recipients"": [], ""timestamp"": ""Sat, Jan 10, 2015 at 10:22 AM"", ""subject"": ""Re:"", ""body"": ""Can you talk at noon? Probably need about 30 minutes. What is best number?""}, {""sender"": ""jeffrey E. [jeevacation@gmail.com]"", ""recipients"": [""Michael Wolff""], ""timestamp"": ""1/10/2015 2:57:45 PM"", ""subject"": ""Re:"", ""body"": ""talk then""}]",5,"____________________ the story teller , crafted much of it out of whole cloth. . part of her story, is that she was at multiple orgies with clinton and speciifically, the minute details of a dinner had on the island with him, "" he sat on my left. came by black. heli. flown by ghislaine. clinton was NEVER EVER there, never, it punches a hole in the dershowitz , andrew allegation. making it all apparent that it was fantasy. and delusional. thoughts. who should break the story. [MSG] Is Clinton willing to say he was not there? Btw, I've just filed a column for USA Today for Monday explaining how Dershowitz and Andrew allegations were picked up from unverified civil court docs, transferred to UK tabs, which go wild because of no libel rules on U.S. court papers, and then translated back here as ""reported fact."" Problem with Mi=story is that tabs are too invested in present story line, and unlikely that the Times or WSJ will want to touch it--tho, depending on who is willing to on record, they might. There is another politico reporter I know who might do it, again, if the on-the-record sources are public people. Or, I will use it for New York Magazine, but that won't be until Feb. Can you still talk tomorrow? When works? Woody and Soon-Yi coming for dinner tonight. m [MSG] anytime tomorw ok [MSG] Can you talk at noon? Probably need about 30 minutes. What is best number? [MSG] talk then","['jeffrey E. <jeevacation@gmail.com>', 'Michael Wolff <:MM11>', 'Michael Wolff <_____________________________>', 'jeffrey E. [jeevacation@gmail.com]']","Fri, Jan 9, 2015 at 1:20 PM → 1/10/2015 2:57:45 PM","Re: ____________________ the story teller , crafted much of it out of whole cloth. . part of her story, is that she was at multiple orgies with clinton and speciifically, the minute details of a dinner had on the island with him, "" he sat on my left. came by black. heli. flown by ghislaine. clinton was NEVER EVER there, never, it punches a hole in the dershowitz , andrew allegation. making it all apparent that it was fantasy. and delusional. thoughts. who should break the story. [MSG] Is Clinton willing to say he was not there? Btw, I've just filed a column for USA Today for Monday explaining how Dershowitz and Andrew allegations were picked up from unverified civil court docs, transferred to UK tabs, which go wild because of no libel rules on U.S. court papers, and then translated back here as ""reported fact."" Problem with Mi=story is that tabs are too invested in present story line, and unlikely that the Times or WSJ will want to touch it--tho, depending on who is willing to on record, they might. There is another politico reporter I know who might do it, again, if the on-the-record sources are public people. Or, I will use it for New York Magazine, but that won't be until Feb. Can you still talk tomorrow? When works? Woody and Soon-Yi coming for dinner tonight. m [MSG] anytime tomorw ok [MSG] Can you talk at noon? Probably need about 30 minutes. What is best number? [MSG] talk then",0.9931605458259584,1,0.18888090550899506,0.06141098961234093,0.7226191163063049,0.15745989978313446,0.48871150612831116,0.5072633624076843,"['obstruction or witness tampering', 'coercion or blackmail', 'network facilitation or coordination']",obstruction or witness tampering,"{'PERSON': ['clinton', 'heli', 'andrew allegation', 'Clinton', 'Andrew'], 'ORG': ['NEVER EVER', 'dershowitz', 'USA Today', 'Dershowitz', 'Times', 'WSJ', 'New York Magazine'], 'DATE': ['Monday', 'Feb.', 'tomorrow'], 'GPE': ['UK', 'U.S.']}","obstruction or witness tampering, coercion or blackmail, network facilitation or coordination","jeffrey E. <jeevacation@gmail.com>, Michael Wolff <:MM11>, Michael Wolff <_____________________________>",⚠️ Problematic,"{'PERSON': ['clinton', 'heli', 'andrew allegation', 'Clinton', 'Andrew'], 'ORG': ['NEVER EVER', 'dershowitz', 'USA Today', 'Dershowitz', 'Times', 'WSJ', 'New York Magazine'], 'DATE': ['Monday', 'Feb.', 'tomorrow'], 'GPE': ['UK', 'U.S.']}"
