thread_id,source_file,subject,messages,message_count,full_text,senders,date_range,text_for_classification,prob_score,risk_flag,score_sexual_exploitation_or_trafficking,score_financial_fraud_or_money_laundering,score_obstruction_or_witness_tampering,score_bribery_or_corruption,score_coercion_or_blackmail,score_network_facilitation_or_coordination,offense_labels,primary_offense,entities,offense_labels_display,senders_display,risk_display,entities_json
IMAGES-007-HOUSE_OVERSIGHT_022815.txt_303,IMAGES-007-HOUSE_OVERSIGHT_022815.txt,CONFIDENTIAL SETTLEMENT DISCUSSIONS/NO PRIVILEGE WAIVER/PER YOUR REQUEST,"[{""sender"": ""Brad Edward"", ""recipients"": [""jeevacation@gmail.com""], ""timestamp"": ""4/6/2018 3:49:11 PM"", ""subject"": ""CONFIDENTIAL SETTLEMENT DISCUSSIONS/NO PRIVILEGE WAIVER/PER YOUR REQUEST"", ""body"": ""I expect a crisp, new bill. Your personalized message can say whatever you would like but it should include, “you win!”""}]",1,"I expect a crisp, new bill. Your personalized message can say whatever you would like but it should include,  you win!",['Brad Edward'],4/6/2018 3:49:11 PM,"CONFIDENTIAL SETTLEMENT DISCUSSIONS/NO PRIVILEGE WAIVER/PER YOUR REQUEST I expect a crisp, new bill. Your personalized message can say whatever you would like but it should include,  you win!",0.8203617930412292,1,0.015163966454565525,0.01767866313457489,0.007055618334561586,0.015220310539007187,0.26413241028785706,0.5421623587608337,['network facilitation or coordination'],network facilitation or coordination,{},network facilitation or coordination,Brad Edward,⚠️ Problematic,{}
IMAGES-012-HOUSE_OVERSIGHT_033343.txt_310,IMAGES-012-HOUSE_OVERSIGHT_033343.txt,POTUS,"[{""sender"": ""Larry Visoski PF"", ""recipients"": [""Je vacation [jeevacation@gmail.com]""], ""timestamp"": ""2/13/2019 6:07:04 PM"", ""subject"": ""POTUS"", ""body"": ""Jeffrey\n\nPres Trump arrives PBI Friday the 15th at 6pm,\nHe departs Monday 18th 4:30pm\n\nMay effect our PBI arrival from Puerta Plata if we travel on Monday,, just heads up,,.\n\nThx,\nLarry""}]",1,"Jeffrey Pres Trump arrives PBI Friday the 15th at 6pm, He departs Monday 18th 4:30pm May effect our PBI arrival from Puerta Plata if we travel on Monday,, just heads up,,. Thx, Larry",['Larry Visoski PF'],2/13/2019 6:07:04 PM,"POTUS Jeffrey Pres Trump arrives PBI Friday the 15th at 6pm, He departs Monday 18th 4:30pm May effect our PBI arrival from Puerta Plata if we travel on Monday,, just heads up,,. Thx, Larry",0.9870675206184388,1,0.006598901003599167,0.015395923517644405,0.20431655645370483,0.043193697929382324,0.14403361082077026,0.8865052461624146,['network facilitation or coordination'],network facilitation or coordination,"{'PERSON': ['Jeffrey Pres Trump', 'Larry'], 'DATE': ['Friday the 15th', 'Monday 18th 4:30pm', 'Monday'], 'ORG': ['Puerta Plata']}",network facilitation or coordination,Larry Visoski PF,⚠️ Problematic,"{'PERSON': ['Jeffrey Pres Trump', 'Larry'], 'DATE': ['Friday the 15th', 'Monday 18th 4:30pm', 'Monday'], 'ORG': ['Puerta Plata']}"
TEXT-001-HOUSE_OVERSIGHT_031442.txt_323,TEXT-001-HOUSE_OVERSIGHT_031442.txt,failure notice,"[{""sender"": ""MAILER-DAEMON@p3plIsmtp05-03.prod.phx3.secureserver.net"", ""recipients"": [""jeevacation@gmail.com""], ""timestamp"": ""1/6/2015 1:15:20 AM"", ""subject"": ""failure notice"", ""body"": ""Your mail message to the following address(es) could not be delivered.\nThis is a permanent error. Please verify the address(es) and try again.\n<christina@jeffreyepstein.org>:\nchild status 100...The e-mail message could not be delivered because the user's mailfolder is full.""}]",1,Your mail message to the following address(es) could not be delivered. This is a permanent error. Please verify the address(es) and try again. : child status 100...The e-mail message could not be delivered because the user's mailfolder is full.,['MAILER-DAEMON@p3plIsmtp05-03.prod.phx3.secureserver.net'],1/6/2015 1:15:20 AM,failure notice Your mail message to the following address(es) could not be delivered. This is a permanent error. Please verify the address(es) and try again. : child status 100...The e-mail message could not be delivered because the user's mailfolder is full.,0.9924129247665404,1,0.014283856377005577,0.006484477315098047,0.03284921869635582,0.009519803337752819,0.021802423521876335,0.2510826587677002,['unclassified'],unclassified,{},unclassified,MAILER-DAEMON@p3plIsmtp05-03.prod.phx3.secureserver.net,⚠️ Problematic,{}
IMAGES-012-HOUSE_OVERSIGHT_033425.txt_328,IMAGES-012-HOUSE_OVERSIGHT_033425.txt,[No Subject],"[{""sender"": ""Robert Trivers [nn"", ""recipients"": [""Jeffrey Epstein [jeevacation@gmail.com]""], ""timestamp"": ""12/22/2018 12:03:25 AM"", ""subject"": null, ""body"": ""Apologies for requesting support in what was originally intended as an update on work done\n\niam done with that, you will receive no more messages from me regarding funding, i am most grateful for your\nhelp—without it, i doubt 1 would have a book in view on Honour killings—i can finish it on my own and fully\nintend to\n\nyou once said you would \""never not support me\"" but never, as we both know, is a very long time—i am much\nmore scared of Trump's capacity to destroy the stock market—but as long as i do not get orders from you to\nsell, 1 will ride it out\n\ni hope everything is good in your life\n\nwarmest best, as always\n\nbob""}]",1,"Apologies for requesting support in what was originally intended as an update on work done iam done with that, you will receive no more messages from me regarding funding, i am most grateful for your help without it, i doubt 1 would have a book in view on Honour killings i can finish it on my own and fully intend to you once said you would ""never not support me"" but never, as we both know, is a very long time i am much more scared of Trump's capacity to destroy the stock market but as long as i do not get orders from you to sell, 1 will ride it out i hope everything is good in your life warmest best, as always bob",['Robert Trivers [nn'],12/22/2018 12:03:25 AM,"[No Subject] Apologies for requesting support in what was originally intended as an update on work done iam done with that, you will receive no more messages from me regarding funding, i am most grateful for your help without it, i doubt 1 would have a book in view on Honour killings i can finish it on my own and fully intend to you once said you would ""never not support me"" but never, as we both know, is a very long time i am much more scared of Trump's capacity to destroy the stock market but as long as i do not get orders from you to sell, 1 will ride it out i hope everything is good in your life warmest best, as always bob",0.9857066869735718,1,0.0039731599390506744,0.10005856305360794,0.21313151717185974,0.06276215612888336,0.2707276940345764,0.22126151621341705,['unclassified'],unclassified,"{'PERSON': ['iam'], 'ORG': ['Trump']}",unclassified,Robert Trivers [nn,⚠️ Problematic,"{'PERSON': ['iam'], 'ORG': ['Trump']}"
TEXT-002-HOUSE_OVERSIGHT_031822.txt_330,TEXT-002-HOUSE_OVERSIGHT_031822.txt,"From Fox News - DOJ to investigate plea bargain awarded to Clinton-linked sex offender Jeffrey Epstein, but watchdogs say probe is tainted","[{""sender"": null, ""recipients"": [""jeevacation@gmail.com""], ""timestamp"": ""2/7/2019 3:36:37 AM"", ""subject"": ""From Fox News - DOJ to investigate plea bargain awarded to Clinton-linked sex offender Jeffrey Epstein, but watchdogs say probe is tainted"", ""body"": ""DOJ to investigate plea bargain awarded to Clinton-linked sex offender Jeffrey Epstein, but watchdogs say probe is tainted\nhttps://www.foxnews.com/politics/doj-opens-probe-into-plea-bargain-awarded-by-trump-official-to-alleged-pedophile-predator-jeffrey-epstein\nIt is bizarre to see who tries to get political mileage out of this.""}]",1,"DOJ to investigate plea bargain awarded to Clinton-linked sex offender Jeffrey Epstein, but watchdogs say probe is tainted https://www.foxnews.com/politics/doj-opens-probe-into-plea-bargain-awarded-by-trump-official-to-alleged-pedophile-predator-jeffrey-epstein It is bizarre to see who tries to get political mileage out of this.",[],2/7/2019 3:36:37 AM,"From Fox News - DOJ to investigate plea bargain awarded to Clinton-linked sex offender Jeffrey Epstein, but watchdogs say probe is tainted DOJ to investigate plea bargain awarded to Clinton-linked sex offender Jeffrey Epstein, but watchdogs say probe is tainted https://www.foxnews.com/politics/doj-opens-probe-into-plea-bargain-awarded-by-trump-official-to-alleged-pedophile-predator-jeffrey-epstein It is bizarre to see who tries to get political mileage out of this.",0.9953960180282592,1,0.9397311806678772,0.00048505153972655535,0.6478729844093323,0.730691134929657,0.6028657555580139,0.6065114140510559,"['sexual exploitation or trafficking', 'obstruction or witness tampering', 'bribery or corruption', 'coercion or blackmail', 'network facilitation or coordination']",sexual exploitation or trafficking,"{'PERSON': ['Clinton', 'Jeffrey Epstein', 'https://www.foxnews.com/politics/doj-opens-probe-into-plea-bargain-awarded-by-trump-official-to-alleged-pedophile-predator-jeffrey-epstein']}","sexual exploitation or trafficking, obstruction or witness tampering, bribery or corruption, coercion or blackmail, network facilitation or coordination",,⚠️ Problematic,"{'PERSON': ['Clinton', 'Jeffrey Epstein', 'https://www.foxnews.com/politics/doj-opens-probe-into-plea-bargain-awarded-by-trump-official-to-alleged-pedophile-predator-jeffrey-epstein']}"
IMAGES-012-HOUSE_OVERSIGHT_033431.txt_339,IMAGES-012-HOUSE_OVERSIGHT_033431.txt,Re:,"[{""sender"": ""J"", ""recipients"": [""Weingarten, Reid""], ""timestamp"": ""Wednesday, February 20, 2019 2:51 PM"", ""subject"": ""Re:"", ""body"": ""https://www.cnbc.com/2019/02/20/ex-trump-lawyer-michael-cohen-gets-prison-surrender-date-delayed-two-months-to-may-6.html""}, {""sender"": ""Weingarten, Reid"", ""recipients"": [""J [jeevacation@gmail.com]""], ""timestamp"": ""Thu, Feb 21, 2019 at 8:51 AM"", ""subject"": ""Re:"", ""body"": ""Is she in de today or tomorrow?""}, {""sender"": ""J"", ""recipients"": [""Weingarten, Reid""], ""timestamp"": ""Thursday, February 21, 2019 8:52 AM"", ""subject"": ""Re:"", ""body"": ""Trust me""}, {""sender"": ""Weingarten, Reid"", ""recipients"": [""J [jeevacation@gmail.com]""], ""timestamp"": ""2/21/2019 1:54:02 PM"", ""subject"": ""Re:"", ""body"": ""Of course I trust you...what is going on?""}]",4,https://www.cnbc.com/2019/02/20/ex-trump-lawyer-michael-cohen-gets-prison-surrender-date-delayed-two-months-to-may-6.html [MSG] Is she in de today or tomorrow? [MSG] Trust me [MSG] Of course I trust you...what is going on?,"['J', 'Weingarten, Reid']","Wednesday, February 20, 2019 2:51 PM → 2/21/2019 1:54:02 PM",Re: https://www.cnbc.com/2019/02/20/ex-trump-lawyer-michael-cohen-gets-prison-surrender-date-delayed-two-months-to-may-6.html [MSG] Is she in de today or tomorrow? [MSG] Trust me [MSG] Of course I trust you...what is going on?,0.9905250668525696,1,0.24411866068840027,0.6789947748184204,0.7991342544555664,0.5076145529747009,0.9787342548370361,0.9811181426048279,"['financial fraud or money laundering', 'obstruction or witness tampering', 'bribery or corruption', 'coercion or blackmail', 'network facilitation or coordination']",financial fraud or money laundering,"{'DATE': ['today', 'tomorrow'], 'ORG': ['MSG] Trust']}","financial fraud or money laundering, obstruction or witness tampering, bribery or corruption, coercion or blackmail, network facilitation or coordination","J, Weingarten, Reid",⚠️ Problematic,"{'DATE': ['today', 'tomorrow'], 'ORG': ['MSG] Trust']}"
IMAGES-008-HOUSE_OVERSIGHT_025118.txt_340,IMAGES-008-HOUSE_OVERSIGHT_025118.txt,Re: Is Donald still feeling good,"[{""sender"": ""LHS"", ""recipients"": [""jeffrey E. [jeevacation@gmail.com]""], ""timestamp"": ""5/29/2017 12:49:27 AM"", ""subject"": ""Re: Is Donald still feeling good"", ""body"": ""With demand happy to consider and likely do. Dont want to go sucking up.\n\nDid Klein do it again? Agree bad business. Or are u referring to what u talked about months ago.""}, {""sender"": ""jeffrey E. <jeevacation@gmail.com>"", ""recipients"": [], ""timestamp"": ""May 28, 2017, at 7:49 PM"", ""subject"": ""Re: Is Donald still feeling good"", ""body"": ""BTW, still not sure why michael klein decided to try to attack me. wasn't smart or necessary, . used our friendship asa source,. thought you should know. not nice""}, {""sender"": ""LHS"", ""recipients"": [], ""timestamp"": ""Sun, May 28, 2017 at 7:36 PM"", ""subject"": ""Re: Is Donald still feeling good"", ""body"": ""More would represent Donald if Kaslowitz out of picture. Not surprising. very hard to be law firm representing POTUS and know what to do when potus lies to u.\n\nMy world thinks poorly of Gorelick for representing Jared.\n\nHow guilty is Donald?\n\nOf crudity surely\n\nOf gross ignorance surely\n\nOf being utterly without the intellect temperament for job surely\n\nOf being over line on family profiting very likely\n\nOf gross disregard for appearances almost surely.\n\nOf Russians having financial leverage. Less clear\n\nOf Russians helping in. Election w complicity of his campaign plausible but not certain\n\nStrikes me if u work for Donald u don't free lance so he is guilty of whatever his campaign did.\n\nDo u agree w foregoing?""}]",3,"With demand happy to consider and likely do. Dont want to go sucking up. Did Klein do it again? Agree bad business. Or are u referring to what u talked about months ago. [MSG] BTW, still not sure why michael klein decided to try to attack me. wasn't smart or necessary, . used our friendship asa source,. thought you should know. not nice [MSG] More would represent Donald if Kaslowitz out of picture. Not surprising. very hard to be law firm representing POTUS and know what to do when potus lies to u. My world thinks poorly of Gorelick for representing Jared. How guilty is Donald? Of crudity surely Of gross ignorance surely Of being utterly without the intellect temperament for job surely Of being over line on family profiting very likely Of gross disregard for appearances almost surely. Of Russians having financial leverage. Less clear Of Russians helping in. Election w complicity of his campaign plausible but not certain Strikes me if u work for Donald u don't free lance so he is guilty of whatever his campaign did. Do u agree w foregoing?","['LHS', 'jeffrey E. <jeevacation@gmail.com>']","5/29/2017 12:49:27 AM → Sun, May 28, 2017 at 7:36 PM","Re: Is Donald still feeling good With demand happy to consider and likely do. Dont want to go sucking up. Did Klein do it again? Agree bad business. Or are u referring to what u talked about months ago. [MSG] BTW, still not sure why michael klein decided to try to attack me. wasn't smart or necessary, . used our friendship asa source,. thought you should know. not nice [MSG] More would represent Donald if Kaslowitz out of picture. Not surprising. very hard to be law firm representing POTUS and know what to do when potus lies to u. My world thinks poorly of Gorelick for representing Jared. How guilty is Donald? Of crudity surely Of gross ignorance surely Of being utterly without the intellect temperament for job surely Of being over line on family profiting very likely Of gross disregard for appearances almost surely. Of Russians having financial leverage. Less clear Of Russians helping in. Election w complicity of his campaign plausible but not certain Strikes me if u work for Donald u don't free lance so he is guilty of whatever his campaign did. Do u agree w foregoing?",0.9741578102111816,1,0.04318875074386597,0.20331645011901855,0.7286838889122009,0.3382786214351654,0.839768648147583,0.7118934392929077,"['obstruction or witness tampering', 'bribery or corruption', 'coercion or blackmail', 'network facilitation or coordination']",obstruction or witness tampering,"{'PERSON': ['Klein', 'michael klein', 'Donald', 'Gorelick', 'Strikes'], 'DATE': ['about months ago'], 'GPE': ['Kaslowitz']}","obstruction or witness tampering, bribery or corruption, coercion or blackmail, network facilitation or coordination","LHS, jeffrey E. <jeevacation@gmail.com>",⚠️ Problematic,"{'PERSON': ['Klein', 'michael klein', 'Donald', 'Gorelick', 'Strikes'], 'DATE': ['about months ago'], 'GPE': ['Kaslowitz']}"
TEXT-001-HOUSE_OVERSIGHT_030748.txt_343,TEXT-001-HOUSE_OVERSIGHT_030748.txt,Re:,"[{""sender"": ""jeffrey E. [jeevacation@gmail.com]"", ""recipients"": [""G Maxwell [GMax1@ellmax.com]""], ""timestamp"": ""Saturday, 10 January 2015 09:12"", ""subject"": ""Re:"", ""body"": ""inital respone, too many unanswerd question raised, realtionship with jeffrey/, ? you and clinton? her and andrew? whats the deal here? why is she there . this is who i am, this how i know jeffrey, employed from „ to.. . I was aware that jeffrey hired masag people, I sometine hired them, she was one of them. recolletion empllyed, firmative. . what. I am writing to writin to respond to the alleagtinoin that have been made whcich are categoricly untrue. . during hte time i met mr derhsowiz , in general inviting a subpeona. ? you will never answer questions to the press satisfaction they will not be persuaded.""}, {""sender"": ""jeffrey E."", ""recipients"": [""G Maxwell""], ""timestamp"": ""Saturday, 10 January 2015 09:18"", ""subject"": ""Re:"", ""body"": ""yes""}, {""sender"": ""Jeffrey E."", ""recipients"": [""G Maxwell""], ""timestamp"": ""Saturday, 10 January 2015 09:31"", ""subject"": ""Re:"", ""body"": ""i am on the phone with other attny getting you an answer.""}, {""sender"": ""G Maxwell <GMax1@ellmax.com>"", ""recipients"": [], ""timestamp"": ""Sat, Jan 10, 2015 at 10:33 AM"", ""subject"": ""Re:"", ""body"": ""I need it written out in full.""}, {""sender"": ""jeffrey E. [jeevacation@gmail.com]"", ""recipients"": [""G Maxwell [GMax1@ellmax.com]""], ""timestamp"": ""1/10/2015 2:41:47 PM"", ""subject"": ""Re:"", ""body"": ""call me""}]",5,"inital respone, too many unanswerd question raised, realtionship with jeffrey/, ? you and clinton? her and andrew? whats the deal here? why is she there . this is who i am, this how i know jeffrey, employed from   to.. . I was aware that jeffrey hired masag people, I sometine hired them, she was one of them. recolletion empllyed, firmative. . what. I am writing to writin to respond to the alleagtinoin that have been made whcich are categoricly untrue. . during hte time i met mr derhsowiz , in general inviting a subpeona. ? you will never answer questions to the press satisfaction they will not be persuaded. [MSG] yes [MSG] i am on the phone with other attny getting you an answer. [MSG] I need it written out in full. [MSG] call me","['jeffrey E. [jeevacation@gmail.com]', 'jeffrey E.', 'Jeffrey E.', 'G Maxwell <GMax1@ellmax.com>']","Saturday, 10 January 2015 09:12 → 1/10/2015 2:41:47 PM","Re: inital respone, too many unanswerd question raised, realtionship with jeffrey/, ? you and clinton? her and andrew? whats the deal here? why is she there . this is who i am, this how i know jeffrey, employed from   to.. . I was aware that jeffrey hired masag people, I sometine hired them, she was one of them. recolletion empllyed, firmative. . what. I am writing to writin to respond to the alleagtinoin that have been made whcich are categoricly untrue. . during hte time i met mr derhsowiz , in general inviting a subpeona. ? you will never answer questions to the press satisfaction they will not be persuaded. [MSG] yes [MSG] i am on the phone with other attny getting you an answer. [MSG] I need it written out in full. [MSG] call me",0.9900527000427246,1,0.17032305896282196,0.14029470086097717,0.784450352191925,0.22533762454986572,0.635114848613739,0.7559216022491455,"['obstruction or witness tampering', 'coercion or blackmail', 'network facilitation or coordination']",obstruction or witness tampering,"{'PERSON': ['jeffrey/', 'clinton', 'andrew', 'jeffrey', 'masag people']}","obstruction or witness tampering, coercion or blackmail, network facilitation or coordination","jeffrey E. [jeevacation@gmail.com], jeffrey E., Jeffrey E.",⚠️ Problematic,"{'PERSON': ['jeffrey/', 'clinton', 'andrew', 'jeffrey', 'masag people']}"
IMAGES-012-HOUSE_OVERSIGHT_033357.txt_356,IMAGES-012-HOUSE_OVERSIGHT_033357.txt,my occasional tweet,"[{""sender"": ""paul krassner"", ""recipients"": [""Kevin Bright"", ""Danny Goldberg""], ""timestamp"": ""5/9/2019 11:24:30 PM"", ""subject"": ""my occasional tweet"", ""body"": ""“Trump has grabbed the pussy of the Statue of Liberty.”""}]",1,Trump has grabbed the pussy of the Statue of Liberty.,['paul krassner'],5/9/2019 11:24:30 PM,my occasional tweet Trump has grabbed the pussy of the Statue of Liberty.,0.9639784693717957,1,0.2238856852054596,0.0016007673693820834,0.15127994120121002,0.09326247125864029,0.4157986044883728,0.005229888018220663,['coercion or blackmail'],coercion or blackmail,{'ORG': ['Trump']},coercion or blackmail,paul krassner,⚠️ Problematic,{'ORG': ['Trump']}
