thread_id,source_file,subject,messages,message_count,full_text,senders,date_range,text_for_classification,prob_score,risk_flag,score_sexual_exploitation_or_trafficking,score_financial_fraud_or_money_laundering,score_obstruction_or_witness_tampering,score_bribery_or_corruption,score_coercion_or_blackmail,score_network_facilitation_or_coordination,offense_labels,primary_offense,entities,offense_labels_display,senders_display,risk_display,entities_json
IMAGES-007-HOUSE_OVERSIGHT_023302.txt_606,IMAGES-007-HOUSE_OVERSIGHT_023302.txt,Fw: Fw: sched,"[{""sender"": ""Unknown"", ""recipients"": [""Melanie Spinella""], ""timestamp"": ""Fri, Dec 11, 2015 at 9:49 AM"", ""subject"": ""fee"", ""body"": ""I wouldn’t mind attending a meeting or portion of a meeting with JE. If he is the mastermind, and you want to move quickly, it might get a lot of questions resolved quickly.""}, {""sender"": ""Brad Wechsler"", ""recipients"": [""jeevacation@gmail.com""], ""timestamp"": ""Thursday, December 10, 2015 5:37 PM"", ""subject"": ""Fw: Fw: sched"", ""body"": ""On different subject: general time frame is: docs (notes and purchase and sale agreement to you tomorrow end. of biz); incorporate your comments monday and get docs to trust attorney tuesday; contemporaneously meet in person with you tuesday or wednesday and do a dry run. On these days ada will also take the trustees through outline of docs they will receive thursday. Docs to trustees, leon et al on thursday and signatures gathered by friday for first close 12/22. Tight but doable. Ada, alan agree?\n\nPS: ada, you shld begin to think abt where people are (jh, rr, bc, Idb) next week.""}, {""sender"": ""Heather Gray"", ""recipients"": [""Brad Wechsler""], ""timestamp"": ""Thursday, December 10, 2015 05:24 PM"", ""subject"": ""RE: Fw:"", ""body"": ""No, ’m meeting with him at 9:30 am tomorrow.""}, {""sender"": null, ""recipients"": [""Melanie Spinella""], ""timestamp"": ""Tue, Apr 14, 2015 at 5:53 PM"", ""subject"": ""Fw: Fw: sched"", ""body"": ""elegant solution ;re fee. , 30 million paid now. with purchase of noel kalb, paid with funds from the drawdown. you should use and keep open the line for the full 30m and leave it outstanding until its expiration. in four months. legit biz reason, very nice , - the balance of the fee - paid inkind either low basis art . or interest in either milenium ,lone cascade ,or king street.""}, {""sender"": null, ""recipients"": [], ""timestamp"": ""Wed, Apr 15, 2015 at 8:59 AM"", ""subject"": ""Fw: Fw: sched"", ""body"": ""saved you 500k at the last minute, . brad has had the same chart since march 16th, its his job to review NOT MINE .appears he is one of those living in the dark leiwe. I found 8 million dollars today, missed deductions. . not yet in the numbers, .?""}, {""sender"": null, ""recipients"": [""Melanie Spinella""], ""timestamp"": ""Mon, May 18, 2015 at 8:17 AM"", ""subject"": ""agenda for tomorrrow"", ""body"": ""1 did the paul weiss bill get paid ??? 2. Talk to me before signing anything today important\n\n10m paid today to gratitude america, a 501 c 3, willl make last year complete. 20 million paid today ftc . 10 million july 15 5 million sept 30. ,5 millionjan 1 forall of 16. tax savings paid at 37 percent . of net. savings. 50 million credit. net. so 150 million free. 600 savings 225 million owed. - 50 credit, 175 owed.""}]",6,"I wouldn t mind attending a meeting or portion of a meeting with JE. If he is the mastermind, and you want to move quickly, it might get a lot of questions resolved quickly. [MSG] On different subject: general time frame is: docs (notes and purchase and sale agreement to you tomorrow end. of biz); incorporate your comments monday and get docs to trust attorney tuesday; contemporaneously meet in person with you tuesday or wednesday and do a dry run. On these days ada will also take the trustees through outline of docs they will receive thursday. Docs to trustees, leon et al on thursday and signatures gathered by friday for first close 12/22. Tight but doable. Ada, alan agree? PS: ada, you shld begin to think abt where people are (jh, rr, bc, Idb) next week. [MSG] No,  m meeting with him at 9:30 am tomorrow. [MSG] elegant solution ;re fee. , 30 million paid now. with purchase of noel kalb, paid with funds from the drawdown. you should use and keep open the line for the full 30m and leave it outstanding until its expiration. in four months. legit biz reason, very nice , - the balance of the fee - paid inkind either low basis art . or interest in either milenium ,lone cascade ,or king street. [MSG] saved you 500k at the last minute, . brad has had the same chart since march 16th, its his job to review NOT MINE .appears he is one of those living in the dark leiwe. I found 8 million dollars today, missed deductions. . not yet in the numbers, .? [MSG] 1 did the paul weiss bill get paid ??? 2. Talk to me before signing anything today important 10m paid today to gratitude america, a 501 c 3, willl make last year complete. 20 million paid today ftc . 10 million july 15 5 million sept 30. ,5 millionjan 1 forall of 16. tax savings paid at 37 percent . of net. savings. 50 million credit. net. so 150 million free. 600 savings 225 million owed. - 50 credit, 175 owed.","['Unknown', 'Brad Wechsler', 'Heather Gray']","Fri, Dec 11, 2015 at 9:49 AM → Mon, May 18, 2015 at 8:17 AM","Fw: Fw: sched I wouldn t mind attending a meeting or portion of a meeting with JE. If he is the mastermind, and you want to move quickly, it might get a lot of questions resolved quickly. [MSG] On different subject: general time frame is: docs (notes and purchase and sale agreement to you tomorrow end. of biz); incorporate your comments monday and get docs to trust attorney tuesday; contemporaneously meet in person with you tuesday or wednesday and do a dry run. On these days ada will also take the trustees through outline of docs they will receive thursday. Docs to trustees, leon et al on thursday and signatures gathered by friday for first close 12/22. Tight but doable. Ada, alan agree? PS: ada, you shld begin to think abt where people are (jh, rr, bc, Idb) next week. [MSG] No,  m meeting with him at 9:30 am tomorrow. [MSG] elegant solution ;re fee. , 30 million paid now. with purchase of noel kalb, paid with funds from the drawdown. you should use and keep open the line for the full 30m and leave it outstanding until its expiration. in four months. legit biz reason, very nice , - the balance of the fee - paid inkind either low basis art . or interest in either milenium ,lone cascade ,or king street. [MSG] saved you 500k at the last minute, . brad has had the same chart since march 16th, its his job to review NOT MINE .appears he is one of those living in the dark leiwe. I found 8 million dollars today, missed deductions. . not yet in the numbers, .? [MSG] 1 did the paul weiss bill get paid ??? 2. Talk to me before signing anything today important 10m paid today to gratitude america, a 501 c 3, willl make last year complete. 20 million paid today ftc . 10 million july 15 5 million sept 30. ,5 millionjan 1 forall of 16. tax savings paid at 37 percent . of net. savings. 50 million credit. net. so 150 million free. 600 savings 225 million owed. - 50 credit, 175 owed.",0.6648426651954651,1,0.04871804639697075,0.12625248730182648,0.06666655838489532,0.03925558924674988,0.0482492633163929,0.7877120971679688,['network facilitation or coordination'],network facilitation or coordination,"{'ORG': ['JE', 'ada', 'al', 'PS: ada', 'MSG'], 'DATE': ['tomorrow', 'monday', 'tuesday', 'wednesday', 'these days', 'thursday', 'friday', 'next week', 'four months', 'march 16th', 'today'], 'PERSON': ['leon et', 'Ada', 'alan agree', 'noel kalb', 'legit', 'biz reason', 'brad', 'paul weiss'], 'MONEY': ['8 million dollars']}",network facilitation or coordination,"Unknown, Brad Wechsler, Heather Gray",⚠️ Problematic,"{'ORG': ['JE', 'ada', 'al', 'PS: ada', 'MSG'], 'DATE': ['tomorrow', 'monday', 'tuesday', 'wednesday', 'these days', 'thursday', 'friday', 'next week', 'four months', 'march 16th', 'today'], 'PERSON': ['leon et', 'Ada', 'alan agree', 'noel kalb', 'legit', 'biz reason', 'brad', 'paul weiss'], 'MONEY': ['8 million dollars']}"
IMAGES-012-HOUSE_OVERSIGHT_033579.txt_608,IMAGES-012-HOUSE_OVERSIGHT_033579.txt,Re: new schedule,"[{""sender"": ""Larry Visosk"", ""recipients"": [""jeffrey E. [jeevacation@gmail.com]"", ""Darren Indyke""], ""timestamp"": ""2/5/2017 12:32:54 AM"", ""subject"": ""Re: new schedule"", ""body"": ""Monday 4pm confirmed\n\nPres Trump departs Monday at 11am,. TFR in place until 11:30am Monday, which requires 24 hour notice for\nDeparture screening if departing during TFR hours.,\nTFR (Temporally Flight Restriction),\n\nOur departure time of 4:30 PM will not be impacted since TFR expires 11:30am Monday,,.\n\nFYI,\n\nFriday, Josh left voicemail indicating chevron should present purchase agreement by midday Monday. for your\nreview.\n\nThx\nLarry""}, {""sender"": ""jeffrey E. <jeevacation@gmail.com>"", ""recipients"": [], ""timestamp"": ""Feb 4, 2017, at 2:58 PM"", ""subject"": ""Re: new schedule"", ""body"": ""monday 4 pmtolsj, thurs morning pre clear to palm beach. sunday 12 new york . tues paris to 21 new\nyork. 24 santa fe. -march 1""}]",2,"Monday 4pm confirmed Pres Trump departs Monday at 11am,. TFR in place until 11:30am Monday, which requires 24 hour notice for Departure screening if departing during TFR hours., TFR (Temporally Flight Restriction), Our departure time of 4:30 PM will not be impacted since TFR expires 11:30am Monday,,. FYI, Friday, Josh left voicemail indicating chevron should present purchase agreement by midday Monday. for your review. Thx Larry [MSG] monday 4 pmtolsj, thurs morning pre clear to palm beach. sunday 12 new york . tues paris to 21 new york. 24 santa fe. -march 1","['Larry Visosk', 'jeffrey E. <jeevacation@gmail.com>']","2/5/2017 12:32:54 AM → Feb 4, 2017, at 2:58 PM","Re: new schedule Monday 4pm confirmed Pres Trump departs Monday at 11am,. TFR in place until 11:30am Monday, which requires 24 hour notice for Departure screening if departing during TFR hours., TFR (Temporally Flight Restriction), Our departure time of 4:30 PM will not be impacted since TFR expires 11:30am Monday,,. FYI, Friday, Josh left voicemail indicating chevron should present purchase agreement by midday Monday. for your review. Thx Larry [MSG] monday 4 pmtolsj, thurs morning pre clear to palm beach. sunday 12 new york . tues paris to 21 new york. 24 santa fe. -march 1",0.1089600250124931,0,0.0,0.0,0.0,0.0,0.0,0.0,['none'],none,"{'DATE': ['Monday 4', 'Monday', 'Friday', 'monday', 'sunday 12'], 'PERSON': ['Pres Trump', 'Josh', 'Larry'], 'ORG': ['TFR', 'Temporally Flight Restriction', 'FYI', 'chevron'], 'GPE': ['palm beach', 'new york', 'paris']}",none,"Larry Visosk, jeffrey E. <jeevacation@gmail.com>",✅ Safe,"{'DATE': ['Monday 4', 'Monday', 'Friday', 'monday', 'sunday 12'], 'PERSON': ['Pres Trump', 'Josh', 'Larry'], 'ORG': ['TFR', 'Temporally Flight Restriction', 'FYI', 'chevron'], 'GPE': ['palm beach', 'new york', 'paris']}"
IMAGES-012-HOUSE_OVERSIGHT_032667.txt_610,IMAGES-012-HOUSE_OVERSIGHT_032667.txt,Re:,"[{""sender"": ""nn"", ""recipients"": [""jeffrey E. [jeevacation@gmail.com]""], ""timestamp"": ""Wed, Dec 6, 2017 at 9:37 AM"", ""subject"": ""Re:"", ""body"": ""very well .. just send me the address again and the code to the door so i can get to the second floor? and send me the day and time.\nthnx""}, {""sender"": ""jeffrey E. <jeevacation@gmail.com>"", ""recipients"": [""nn""], ""timestamp"": ""Dec 6, 2017, at 5:17 PM"", ""subject"": ""Re:"", ""body"": ""You are welcome at my house always . And more private""}, {""sender"": ""jeffrey E. <jeevacation@gmail.com>"", ""recipients"": [""nn""], ""timestamp"": ""Dec 6, 2017, at 5:44 PM"", ""subject"": ""Re:"", ""body"": ""10pm should I bring special cake from New York""}, {""sender"": null, ""recipients"": [], ""timestamp"": ""Fri, Dec 8, 2017 at 2:10 PM"", ""subject"": ""Re:"", ""body"": ""sorry that is 2512 for the gate &""}, {""sender"": ""jeffrey E. <jeevacation@gmail.com>"", ""recipients"": [""nn""], ""timestamp"": ""Dec 8, 2017, at 9:55 PM"", ""subject"": ""Re:"", ""body"": ""Yes""}, {""sender"": ""nn"", ""recipients"": [""jeffrey E. <jeevacation@gmail.com>""], ""timestamp"": ""Fri, Dec 8, 2017 at 9:37 PM"", ""subject"": ""Re:"", ""body"": ""i mat the door but i will wait for my time.. i dont want to come early to find trump in your housee@@""}, {""sender"": ""jeffrey E. <jeevacation@gmail.com>"", ""recipients"": [""nn""], ""timestamp"": ""Dec 8, 2017, at 11:38 PM"", ""subject"": ""Re:"", ""body"": ""no come now !!!""}, {""sender"": ""i"", ""recipients"": [""jeffrey E. <jeevacation@gmail.com>""], ""timestamp"": ""Sat, Dec 9, 2017 at 8:00 AM"", ""subject"": ""Re:"", ""body"": ""i forget to ask .. is there any new update about the saudi project that i sent you??""}, {""sender"": ""jeffrey E. <jeevacation@gmail.com>"", ""recipients"": [], ""timestamp"": ""Dec 9, 2017, at 1:13 PM"", ""subject"": ""Re:"", ""body"": ""They told me to discuss in Jan""}, {""sender"": null, ""recipients"": [""jeffrey E. [jeevacation@gmail.com]""], ""timestamp"": ""12/9/2017 10:32:34 AM"", ""subject"": ""Re:"", ""body"": ""very Welle &""}]",10,very well .. just send me the address again and the code to the door so i can get to the second floor? and send me the day and time. thnx [MSG] You are welcome at my house always . And more private [MSG] 10pm should I bring special cake from New York [MSG] sorry that is 2512 for the gate & [MSG] Yes [MSG] i mat the door but i will wait for my time.. i dont want to come early to find trump in your housee@@ [MSG] no come now !!! [MSG] i forget to ask .. is there any new update about the saudi project that i sent you?? [MSG] They told me to discuss in Jan [MSG] very Welle &,"['nn', 'jeffrey E. <jeevacation@gmail.com>', 'i']","Wed, Dec 6, 2017 at 9:37 AM → 12/9/2017 10:32:34 AM",Re: very well .. just send me the address again and the code to the door so i can get to the second floor? and send me the day and time. thnx [MSG] You are welcome at my house always . And more private [MSG] 10pm should I bring special cake from New York [MSG] sorry that is 2512 for the gate & [MSG] Yes [MSG] i mat the door but i will wait for my time.. i dont want to come early to find trump in your housee@@ [MSG] no come now !!! [MSG] i forget to ask .. is there any new update about the saudi project that i sent you?? [MSG] They told me to discuss in Jan [MSG] very Welle &,0.9711011052131652,1,0.1669759899377823,0.1666717529296875,0.8056431412696838,0.3265492916107178,0.8871064782142639,0.8925744295120239,"['obstruction or witness tampering', 'bribery or corruption', 'coercion or blackmail', 'network facilitation or coordination']",obstruction or witness tampering,"{'DATE': ['the day', '2512'], 'ORG': ['MSG', 'the gate & [', 'Welle &'], 'GPE': ['New York']}","obstruction or witness tampering, bribery or corruption, coercion or blackmail, network facilitation or coordination","nn, jeffrey E. <jeevacation@gmail.com>, i",⚠️ Problematic,"{'DATE': ['the day', '2512'], 'ORG': ['MSG', 'the gate & [', 'Welle &'], 'GPE': ['New York']}"
IMAGES-009-HOUSE_OVERSIGHT_026676.txt_613,IMAGES-009-HOUSE_OVERSIGHT_026676.txt,"Re: long time, no talk...","[{""sender"": ""Weingarten, Reid"", ""recipients"": [""GREG FARRELL (BLOOMBERG/ NEWSROOM: )""], ""timestamp"": null, ""subject"": ""Re: long time, no talk..."", ""body"": ""In trial in sdny""}, {""sender"": ""Greg Farrell (BLOOMBERG/ NEWSROOM:)"", ""recipients"": [""Weingarten, Reid""], ""timestamp"": ""Tuesday, June 20, 2017 11:54 AM"", ""subject"": ""long time, no talk..."", ""body"": ""Hi Reid,\n\nper my vm, I'm chasing a few DC-related legal stories and was hoping you\nmight be able to help me out.\n\nGot any time in the next few days?\n\nThanks,\n\nGreg\n\np.s. Any word from Bernie E? Given Skilling's reduction, Bernie certainly\ndeserves a second look, no?""}]",2,"In trial in sdny [MSG] Hi Reid, per my vm, I'm chasing a few DC-related legal stories and was hoping you might be able to help me out. Got any time in the next few days? Thanks, Greg p.s. Any word from Bernie E? Given Skilling's reduction, Bernie certainly deserves a second look, no?","['Weingarten, Reid', 'Greg Farrell (BLOOMBERG/ NEWSROOM:)']","Tuesday, June 20, 2017 11:54 AM","Re: long time, no talk... In trial in sdny [MSG] Hi Reid, per my vm, I'm chasing a few DC-related legal stories and was hoping you might be able to help me out. Got any time in the next few days? Thanks, Greg p.s. Any word from Bernie E? Given Skilling's reduction, Bernie certainly deserves a second look, no?",0.9787325263023376,1,0.08505334705114365,0.4397730827331543,0.49126115441322327,0.49655067920684814,0.2178514152765274,0.7745306491851807,"['financial fraud or money laundering', 'obstruction or witness tampering', 'bribery or corruption', 'network facilitation or coordination']",financial fraud or money laundering,"{'GPE': ['DC'], 'DATE': ['the next few days'], 'PERSON': ['Bernie E?', 'Bernie']}","financial fraud or money laundering, obstruction or witness tampering, bribery or corruption, network facilitation or coordination","Weingarten, Reid, Greg Farrell (BLOOMBERG/ NEWSROOM:)",⚠️ Problematic,"{'GPE': ['DC'], 'DATE': ['the next few days'], 'PERSON': ['Bernie E?', 'Bernie']}"
IMAGES-010-HOUSE_OVERSIGHT_028970.txt_623,IMAGES-010-HOUSE_OVERSIGHT_028970.txt,Re: Reuters / lawsuit against Jeffrey Epstein,"[{""sender"": ""Martin Weinberg"", ""recipients"": [""Jeff Epstein <jeevacation@gmail.com>""], ""timestamp"": ""Thu, Apr 28, 2016 at 12:20 PM"", ""subject"": ""Fwd: Reuters / lawsuit against Jeffrey Epstein"", ""body"": """"}, {""sender"": ""Ingram, David (Reuters News)"", ""recipients"": [""‘Martin G. Weinberg’""], ""timestamp"": ""Thursday, April 28, 2016 12:14 PM"", ""subject"": ""Reuters / lawsuit against Jeffrey Epstein"", ""body"": ""Hi Marty,\n\nSorry, the suit is attached to this email.""}, {""sender"": ""jeffrey E. [jeevacation@gmail.com]"", ""recipients"": [""Alan M. Dershowitz"", ""Roy Black"", ""Jack Goldberger""], ""timestamp"": ""Thursday, April 28, 2016 12:39 PM"", ""subject"": ""Fwd: Reuters / lawsuit against Jeffrey Epstein"", ""body"": """"}, {""sender"": ""Roy Black"", ""recipients"": [], ""timestamp"": ""Apr 28, 2016, at 12:47 PM"", ""subject"": ""Re: Reuters / lawsuit against Jeffrey Epstein"", ""body"": """"}, {""sender"": ""Alan Dershowitz"", ""recipients"": [""Roy Black""], ""timestamp"": ""4/28/2016 4:51:57 PM"", ""subject"": ""Re: Reuters / lawsuit against Jeffrey Epstein"", ""body"": """"}]",5,"Hi Marty, Sorry, the suit is attached to this email.","['Martin Weinberg', 'Ingram, David (Reuters News)', 'jeffrey E. [jeevacation@gmail.com]', 'Roy Black', 'Alan Dershowitz']","Thu, Apr 28, 2016 at 12:20 PM → 4/28/2016 4:51:57 PM","Re: Reuters / lawsuit against Jeffrey Epstein Hi Marty, Sorry, the suit is attached to this email.",0.9860496520996094,1,0.5764057040214539,0.5793609619140625,0.45282113552093506,0.7136879563331604,0.5462127923965454,0.6745426058769226,"['sexual exploitation or trafficking', 'financial fraud or money laundering', 'obstruction or witness tampering', 'bribery or corruption', 'coercion or blackmail', 'network facilitation or coordination']",sexual exploitation or trafficking,{'PERSON': ['Marty']},"sexual exploitation or trafficking, financial fraud or money laundering, obstruction or witness tampering, bribery or corruption, coercion or blackmail, network facilitation or coordination","Martin Weinberg, Ingram, David (Reuters News), jeffrey E. [jeevacation@gmail.com]",⚠️ Problematic,{'PERSON': ['Marty']}
TEXT-001-HOUSE_OVERSIGHT_031278.txt_625,TEXT-001-HOUSE_OVERSIGHT_031278.txt,PRIVILEGED AND CONFIDENTIAL - Fwd: JAMES PATTERSON NEW BOOK TELLING FEDS COVER UP OF BILLIONAIRE JEFF EPSTEIN CHILD RAPES RELEASE DATE OCT 10 2016 STEVEN HOFFENBERG IS ON THE BOOK WRITING TEAM !!!!,"[{""sender"": ""steven hoffenberg"", ""recipients"": [""Players2""], ""timestamp"": ""August 11, 2016 at 9:36:01 AM EDT"", ""subject"": ""JAMES PATTERSON NEW BOOK TELLING FEDS COVER UP OF BILLIONAIRE JEFF EPSTEIN CHILD RAPES RELEASE DATE OCT 10 2016 STEVEN HOFFENBERG IS ON THE BOOK WRITING TEAM !!!!"", ""body"": ""C E 0 STEVEN HOFFENBERG / TRUMP SUPER PAC / GET OUR JOBS BACK INC\nTO ROGER STONE\nCHILD RAPE BILLIONAIRE JEFF EPSTEIN NEW TELL ALL JAMES PATTERSON BOOK FEDS CO VER UP NO FED ARREST OF MASS CHILD RAPIST BILLIONAIRE JEFF EPSTEIN BOOK RELEASE DATE OCT 10 2016 !nu\nSTEVEN HOFFENBERG IS ON THE JAMES PATTERSON BOOK WRITING TEAM.\nWIN PRESIDENT TRUMP !!!!!!!!!!!!!\nSTEVEN HOFFENBERG IS TAKING BACK THE NEW YORK POST NEWSPAPER OPERATIONS !Hu""}, {""sender"": ""steven hoffenberg"", ""recipients"": [], ""timestamp"": ""August 11, 2016 at 9:42:25 AM EDT"", ""subject"": ""Fwd: JAMES PATTERSON NEW BOOK TELLING FEDS COVER UP OF BILLIONAIRE JEFF EPSTEIN CHILD RAPES RELEASE DATE OCT 10 2016 STEVEN HOFFENBERG IS ON THE BOOK WRITING TEAM !!!!"", ""body"": """"}, {""sender"": ""Darren Indyke"", ""recipients"": [""Michael, Charles""], ""timestamp"": ""Monday, August 15, 2016 5:35 PM"", ""subject"": ""Privileged and Confidential - Fwd: JAMES PATTERSON NEW BOOK TELLING FEDS COVER UP OF BILLIONAIRE JEFF EPSTEIN CHILD RAPES RELEASE DATE OCT 10 2016 STEVEN HOFFENBERG IS ON THE BOOK WRITING TEAM !!!!"", ""body"": ""Thanks,\nRegards,\nDarren""}, {""sender"": ""Michael, Charles"", ""recipients"": [""Darren Indyke""], ""timestamp"": ""August 16, 2016 at 10:42:56 PM EDT"", ""subject"": ""RE: Privileged and Confidential - Fwd: JAMES PATTERSON NEW BOOK TELLING FEDS COVER UP OF BILLIONAIRE JEFF EPSTEIN CHILD RAPES RELEASE DATE OCT 10 2016 STEVEN HOFFENBERG IS ON THE BOOK WRITING TEAM !!!!"", ""body"": ""Darren:""}, {""sender"": ""Darren Indyke"", ""recipients"": [], ""timestamp"": ""Aug 17, 2016, at 11:27 AM"", ""subject"": ""PRIVILEGED AND CONFIDENTIAL - Fwd: JAMES PATTERSON NEW BOOK TELLING FEDS COVER UP OF BILLIONAIRE JEFF EPSTEIN CHILD RAPES RELEASE DATE OCT 10 2016 STEVEN HOFFENBERG IS ON THE BOOK WRITING TEAM !!!!"", ""body"": """"}]",5,"C E 0 STEVEN HOFFENBERG / TRUMP SUPER PAC / GET OUR JOBS BACK INC TO ROGER STONE CHILD RAPE BILLIONAIRE JEFF EPSTEIN NEW TELL ALL JAMES PATTERSON BOOK FEDS CO VER UP NO FED ARREST OF MASS CHILD RAPIST BILLIONAIRE JEFF EPSTEIN BOOK RELEASE DATE OCT 10 2016 !nu STEVEN HOFFENBERG IS ON THE JAMES PATTERSON BOOK WRITING TEAM. WIN PRESIDENT TRUMP !!!!!!!!!!!!! STEVEN HOFFENBERG IS TAKING BACK THE NEW YORK POST NEWSPAPER OPERATIONS !Hu [MSG] Thanks, Regards, Darren [MSG] Darren:","['steven hoffenberg', 'Darren Indyke', 'Michael, Charles']","August 11, 2016 at 9:36:01 AM EDT → Aug 17, 2016, at 11:27 AM","PRIVILEGED AND CONFIDENTIAL - Fwd: JAMES PATTERSON NEW BOOK TELLING FEDS COVER UP OF BILLIONAIRE JEFF EPSTEIN CHILD RAPES RELEASE DATE OCT 10 2016 STEVEN HOFFENBERG IS ON THE BOOK WRITING TEAM !!!! C E 0 STEVEN HOFFENBERG / TRUMP SUPER PAC / GET OUR JOBS BACK INC TO ROGER STONE CHILD RAPE BILLIONAIRE JEFF EPSTEIN NEW TELL ALL JAMES PATTERSON BOOK FEDS CO VER UP NO FED ARREST OF MASS CHILD RAPIST BILLIONAIRE JEFF EPSTEIN BOOK RELEASE DATE OCT 10 2016 !nu STEVEN HOFFENBERG IS ON THE JAMES PATTERSON BOOK WRITING TEAM. WIN PRESIDENT TRUMP !!!!!!!!!!!!! STEVEN HOFFENBERG IS TAKING BACK THE NEW YORK POST NEWSPAPER OPERATIONS !Hu [MSG] Thanks, Regards, Darren [MSG] Darren:",0.8995912671089172,1,0.669194757938385,0.42738762497901917,0.9150394797325134,0.9961944222450256,0.9631730318069458,0.9823795557022095,"['sexual exploitation or trafficking', 'financial fraud or money laundering', 'obstruction or witness tampering', 'bribery or corruption', 'coercion or blackmail', 'network facilitation or coordination']",sexual exploitation or trafficking,"{'PERSON': ['JAMES PATTERSON', 'STEVEN HOFFENBERG IS TAKING BACK', 'Hu', 'Darren'], 'DATE': ['10 2016'], 'ORG': ['WIN PRESIDENT TRUMP', 'THE NEW YORK POST NEWSPAPER OPERATIONS']}","sexual exploitation or trafficking, financial fraud or money laundering, obstruction or witness tampering, bribery or corruption, coercion or blackmail, network facilitation or coordination","steven hoffenberg, Darren Indyke, Michael, Charles",⚠️ Problematic,"{'PERSON': ['JAMES PATTERSON', 'STEVEN HOFFENBERG IS TAKING BACK', 'Hu', 'Darren'], 'DATE': ['10 2016'], 'ORG': ['WIN PRESIDENT TRUMP', 'THE NEW YORK POST NEWSPAPER OPERATIONS']}"
